[
  {
    "slug": "superpowers",
    "name": "Superpowers",
    "nameZh": "Superpowers",
    "description": "完整的 AI 编码智能体软件开发方法论，基于可组合技能。包含头脑风暴、测试驱动开发、方案编写、子智能体驱动开发、代码审查等工作流。",
    "descriptionEn": "A complete AI coding agent software development methodology built on composable skills. Includes brainstorming, TDD, plan writing, subagent-driven development, code review and more.",
    "descriptionJa": "コードエージェント向けの完全なソフトウェア開発方法論。ブレインストーミング、TDD、計画作成、サブエージェント駆動開発、コードレビューなどのスキルを搭載。",
    "descriptionEs": "Una metodología completa de desarrollo de software para agentes de codificación IA. Incluye lluvia de ideas, TDD, redacción de planes, desarrollo impulsado por subagentes, revisión de código.",
    "descriptionFr": "Une méthodologie complète de développement logiciel pour les agents de codage IA. Comprend le brainstorming, le TDD, la rédaction de plans, le développement piloté par sous-agents, la revue de code.",
    "developer": "Prime Radiant (Jesse Vincent)",
    "developerZh": "Prime Radiant（Jesse Vincent）",
    "repo": "obra/superpowers",
    "agents": [
      "claude",
      "cursor",
      "codex",
      "github-copilot",
      "kimi-code",
      "opencode",
      "antigravity",
      "factory-droid"
    ],
    "category": "Developer",
    "tags": [
      "Free",
      "Open Source"
    ],
    "installCommand": "Available via Claude Code marketplace, Cursor /add-plugin, Codex plugin marketplace, and more. See README for details.",
    "logo": "/logos/skills/superpowers.png",
    "stars": 8500,
    "featured": true
  },
  {
    "slug": "hyperdirector",
    "name": "HyperDirector",
    "nameZh": "HyperDirector",
    "description": "HyperFrames 视频制作流水线技能。自动化视频分镜、剪辑、特效编排，高效生成专业级视频内容。",
    "descriptionEn": "HyperFrames video production pipeline skill. Automate video storyboarding, editing, effects orchestration for professional-grade video content.",
    "descriptionJa": "HyperFrames動画制作パイプラインスキル。ビデオ絵コンテ、編集、エフェクトオーケストレーションを自動化。",
    "descriptionEs": "Pipeline de producción de video HyperFrames. Automatiza storyboard, edición y orquestación de efectos.",
    "descriptionFr": "Pipeline de production vidéo HyperFrames. Automatise le storyboard, le montage et l'orchestration des effets.",
    "developer": "gloweaseco-leo",
    "developerZh": "gloweaseco-leo",
    "repo": "gloweaseco-leo/hyperdirector",
    "agents": [
      "claude",
      "cursor",
      "generic"
    ],
    "category": "Video",
    "tags": [
      "Free",
      "Open Source"
    ],
    "installCommand": "See README for installation instructions.",
    "logo": "/logos/skills/hyperdirector.png",
    "stars": 200,
    "featured": true
  },
  {
    "slug": "remotion-best-practices",
    "name": "Remotion Best Practices",
    "nameZh": "Remotion 最佳实践",
    "description": "Remotion 视频开发最佳实践指南技能。覆盖 React 组件化视频开发、性能优化、渲染策略。",
    "descriptionEn": "Remotion video development best practices skill. Covers React component-based video development, performance optimization, rendering strategies.",
    "descriptionJa": "Remotion動画開発のベストプラクティススキル。Reactコンポーネントベースの動画開発、パフォーマンス最適化、レンダリング戦略。",
    "descriptionEs": "Guía de mejores prácticas de desarrollo de video Remotion. Desarrollo de video basado en componentes React, optimización de rendimiento.",
    "descriptionFr": "Guide des meilleures pratiques de développement vidéo Remotion. Développement vidéo basé sur des composants React, optimisation des performances.",
    "developer": "Gyana491",
    "developerZh": "Gyana491",
    "repo": "Gyana491/opencanvas-remotion",
    "agents": [
      "claude",
      "cursor",
      "generic"
    ],
    "category": "Video",
    "tags": [
      "Free",
      "Open Source"
    ],
    "installCommand": "See README for installation instructions.",
    "logo": "/logos/skills/remotion-best-practices.png",
    "stars": 150,
    "featured": true
  },
  {
    "slug": "humanizer",
    "name": "Humanizer",
    "nameZh": "Humanizer",
    "description": "去除 AI 写作痕迹的 MCP 服务。检测 33 种 AI 模式，让 AI 生成文本更自然、更像人类写作。",
    "descriptionEn": "An MCP server that removes AI writing traces. Detects 33 AI patterns to make AI-generated text more natural and human-like.",
    "descriptionJa": "AIライティングの痕跡を除去するMCPサーバー。33種類のAIパターンを検出し、AI生成テキストをより自然に。",
    "descriptionEs": "Un servidor MCP que elimina rastros de escritura IA. Detecta 33 patrones de IA para hacer el texto más natural.",
    "descriptionFr": "Un serveur MCP qui supprime les traces d'écriture IA. Détecte 33 modèles d'IA pour un texte plus naturel.",
    "developer": "blader",
    "developerZh": "blader",
    "repo": "blader/humanizer",
    "agents": [
      "claude",
      "cursor",
      "generic"
    ],
    "category": "Writing",
    "tags": [
      "Free",
      "Open Source"
    ],
    "installCommand": "npx @anthropic-ai/claude add mcp-server-humanizer",
    "logo": "/logos/skills/humanizer.png",
    "stars": 1200,
    "featured": true
  },
  {
    "slug": "ian-xiaohei-illustrations",
    "name": "Ian Xiaohei Illustrations",
    "nameZh": "小黑怪诞插画",
    "description": "为中文文章生成小黑怪诞手绘风格正文配图的 MCP 服务。独特的黑白线稿风格，适合文章插图、博客配图。",
    "descriptionEn": "An MCP server that generates quirky hand-drawn Xiaohei-style illustrations for Chinese articles. Unique black-and-white line art style, perfect for article and blog illustrations.",
    "descriptionJa": "中文記事向けの小黑風イラストを生成するMCPサーバー。独特な白黒線画スタイルで、記事やブログの挿絵に最適。",
    "descriptionEs": "Un servidor MCP que genera ilustraciones Xiaohei para artículos en chino. Estilo único de dibujo lineal en blanco y negro.",
    "descriptionFr": "Un serveur MCP qui génère des illustrations Xiaohei pour les articles chinois. Style unique de dessin au trait noir et blanc.",
    "developer": "helloianneo",
    "developerZh": "helloianneo",
    "repo": "helloianneo/ian-xiaohei-illustrations",
    "agents": [
      "claude",
      "cursor",
      "generic"
    ],
    "category": "Design",
    "tags": [
      "Free",
      "Open Source"
    ],
    "installCommand": "npx @anthropic-ai/claude add ian-xiaohei-illustrations",
    "logo": "/logos/skills/ian-xiaohei-illustrations.png",
    "stars": 350,
    "featured": true
  },
  {
    "slug": "brand",
    "name": "Brand",
    "nameZh": "品牌指南",
    "description": "品牌视觉识别与指南技能。覆盖品牌色、字体、Logo 使用规范、品牌语调、资产管理和一致性检查。",
    "descriptionEn": "Brand visual identity and guidelines skill. Covers brand colors, typography, logo usage, brand voice, asset management, and consistency checks.",
    "descriptionJa": "ブランドビジュアルアイデンティティとガイドラインスキル。ブランドカラー、タイポグラフィ、ロゴ使用、ブランドボイス、一貫性チェック。",
    "descriptionEs": "Habilidad de identidad visual y guías de marca. Colores, tipografía, uso de logotipo, voz de marca, gestión de activos.",
    "descriptionFr": "Compétence d'identité visuelle et de directives de marque. Couleurs, typographie, utilisation du logo, voix de la marque.",
    "developer": "nextlevelbuilder",
    "developerZh": "nextlevelbuilder",
    "repo": "nextlevelbuilder/ui-ux-pro-max-skill",
    "agents": [
      "claude",
      "cursor",
      "codex",
      "generic"
    ],
    "category": "Design",
    "tags": [
      "Free",
      "Open Source"
    ],
    "installCommand": "Available via plugin marketplace. See README for details.",
    "logo": "/logos/skills/brand.png",
    "stars": 600,
    "featured": true
  },
  {
    "slug": "agent-reach",
    "name": "Agent Reach",
    "nameZh": "Agent Reach",
    "description": "互联网能力路由器，连接 15 个平台的 AI 智能体。支持跨平台消息发送、内容发布、数据同步。",
    "descriptionEn": "Internet capability router for AI agents connecting 15 platforms. Supports cross-platform messaging, content publishing, and data sync.",
    "descriptionJa": "15プラットフォームを接続するAIエージェント用インターネット機能ルーター。クロスプラットフォームメッセージ送信、コンテンツ公開、データ同期。",
    "descriptionEs": "Router de capacidad de Internet para agentes IA que conecta 15 plataformas. Mensajería multiplataforma, publicación de contenido, sincronización.",
    "descriptionFr": "Routeur de capacité Internet pour agents IA connectant 15 plateformes. Messagerie multiplateforme, publication de contenu, synchronisation.",
    "developer": "Panniantong",
    "developerZh": "Panniantong",
    "repo": "Panniantong/Agent-Reach",
    "agents": [
      "claude",
      "cursor",
      "generic"
    ],
    "category": "Platform",
    "tags": [
      "Free",
      "Open Source"
    ],
    "installCommand": "See README for installation instructions.",
    "logo": "/logos/skills/agent-reach.png",
    "stars": 250,
    "featured": true
  },
  {
    "slug": "ui-styling",
    "name": "UI Styling",
    "nameZh": "UI 样式指南",
    "description": "UI 样式指南技能。覆盖 Tailwind CSS 工具类、shadcn/ui 组件、响应式设计、暗色模式、主题定制。",
    "descriptionEn": "UI styling guide skill. Covers Tailwind CSS utilities, shadcn/ui components, responsive design, dark mode, theme customization.",
    "descriptionJa": "UIスタイリングガイドスキル。Tailwind CSS、shadcn/uiコンポーネント、レスポンシブデザイン、ダークモード、テーマカスタマイズ。",
    "descriptionEs": "Guía de estilo UI. Utilidades Tailwind CSS, componentes shadcn/ui, diseño responsive, modo oscuro, personalización de temas.",
    "descriptionFr": "Guide de style UI. Utilitaires Tailwind CSS, composants shadcn/ui, design responsive, mode sombre, personnalisation du thème.",
    "developer": "nextlevelbuilder",
    "developerZh": "nextlevelbuilder",
    "repo": "nextlevelbuilder/ui-ux-pro-max-skill",
    "agents": [
      "claude",
      "cursor",
      "codex",
      "generic"
    ],
    "category": "Design",
    "tags": [
      "Free",
      "Open Source"
    ],
    "installCommand": "Available via plugin marketplace. See README for details.",
    "logo": "/logos/skills/ui-styling.png",
    "stars": 600,
    "featured": true
  },
  {
    "slug": "design-system",
    "name": "Design System",
    "nameZh": "设计系统",
    "description": "设计系统与 Token 管理技能。覆盖设计 Token 架构、组件规范、CSS 变量、间距/字体比例尺。",
    "descriptionEn": "Design system and token management skill. Covers design token architecture, component specs, CSS variables, spacing/typography scales.",